{
  "schema_version": "1.0.0",
  "document_type": "qsol_ns_external_claim_registry",
  "license": "Apache-2.0",
  "as_of": "2026-09-09",
  "repository_baseline_commit": "504180162eb117bc3eb280b93c8ef4df845c0d27",
  "artifact_pins": {
    "OPENAI_NS_BLOWUP_2026": {
      "url": "https://cdn.openai.com/pdf/32d9f210-8b73-45e0-91bc-82a30aef8a9a/navier-stokes.pdf",
      "sha256": "0e779481c4da40bd28d1e642e1d8ca57447d129610df28dfa5a11e9af8ae228f"
    },
    "OPENAI_NS_LEAN_2026": {
      "repository": "openai/NavierStokesAndEuler",
      "commit": "8937a8f4cbc7abaab5e9e97d1cc7f5d2319d9538",
      "url": "https://github.com/openai/NavierStokesAndEuler/tree/8937a8f4cbc7abaab5e9e97d1cc7f5d2319d9538"
    }
  },
  "policy": {
    "repository_claim": "no_solution_claim",
    "independent_verification_required": true,
    "formalization_replay_is_not_mathematical_acceptance": true,
    "historical_theorem_registry_unchanged_until_audited_promotion": true
  },
  "claims": [
    {
      "claim_id": "OPENAI_2026_A",
      "formulation_id": "A",
      "source_ids": ["OPENAI_NS_BLOWUP_2026", "OPENAI_NS_LEAN_2026"],
      "source_position": "not_addressed_by_source",
      "qsol_status": "not_resolved",
      "forcing_relation": "Clay A requires f identically zero; the OpenAI 2026 Navier-Stokes construction is a forced breakdown construction and does not claim A.",
      "statement_summary": "The 2026 OpenAI sources do not claim global smoothness for arbitrary admissible unforced data on R^3.",
      "verification_obligations": [
        "do_not_infer_A_from_C",
        "keep_unforced_global_regularity_separate_from_forced_breakdown"
      ]
    },
    {
      "claim_id": "OPENAI_2026_B",
      "formulation_id": "B",
      "source_ids": ["OPENAI_NS_BLOWUP_2026", "OPENAI_NS_LEAN_2026"],
      "source_position": "not_addressed_by_source",
      "qsol_status": "not_resolved",
      "forcing_relation": "Clay B requires f identically zero; the OpenAI 2026 periodic construction is presented as forced breakdown alternative D and does not claim B.",
      "statement_summary": "The 2026 OpenAI sources do not claim global smoothness for arbitrary admissible unforced periodic data.",
      "verification_obligations": [
        "do_not_infer_B_from_D",
        "preserve_periodic_pressure_and_forcing_requirements"
      ]
    },
    {
      "claim_id": "OPENAI_2026_C",
      "formulation_id": "C",
      "source_ids": ["OPENAI_NS_BLOWUP_2026", "OPENAI_NS_LEAN_2026"],
      "source_position": "claims_satisfied",
      "qsol_status": "external_claim_pending_independent_verification",
      "forcing_relation": "Clay C permits a smooth forcing term. OpenAI Theorem 1.1 constructs smooth compactly supported forcing, starts from zero velocity, keeps kinetic energy uniformly bounded, and makes the velocity L-infinity norm unbounded in finite time.",
      "statement_summary": "OpenAI explicitly states that Theorem 1.1 establishes Fefferman alternative C on R^3.",
      "verification_obligations": [
        "verify_exact_C_statement_correspondence",
        "audit_every_analytic_dependency_of_Theorem_1_1",
        "replay_pinned_Lean_formalization",
        "verify_prose_to_Lean_statement_alignment",
        "obtain_independent_adversarial_review_before_any_QSOL_solution_claim"
      ]
    },
    {
      "claim_id": "OPENAI_2026_D",
      "formulation_id": "D",
      "source_ids": ["OPENAI_NS_BLOWUP_2026", "OPENAI_NS_LEAN_2026"],
      "source_position": "claims_satisfied",
      "qsol_status": "external_claim_pending_independent_verification",
      "forcing_relation": "Clay D permits smooth periodic forcing with the official decay assumptions. OpenAI states that compact support yields the corresponding periodic construction and identifies Corollary 10.6 with alternative D.",
      "statement_summary": "OpenAI explicitly states that its periodic corollary establishes Fefferman alternative D on R^3/Z^3.",
      "verification_obligations": [
        "verify_exact_D_statement_correspondence_including_pressure_periodicity_erratum",
        "audit_periodization_and_localization_arguments",
        "replay_pinned_Lean_formalization",
        "verify_prose_to_Lean_statement_alignment",
        "obtain_independent_adversarial_review_before_any_QSOL_solution_claim"
      ]
    }
  ],
  "machine_invariants": [
    "EXTERNAL_SOURCE_CLAIM != QSOL_VERIFIED_RESULT",
    "LEAN_BUILD_SUCCESS != INDEPENDENT_MATHEMATICAL_ACCEPTANCE",
    "FORMAL_STATEMENT_CORRESPONDENCE_MUST_BE_AUDITED",
    "C_OR_D_CLAIM_DOES_NOT_RESOLVE_A_OR_B",
    "FORCED_BREAKDOWN != UNFORCED_GLOBAL_REGULARITY_RESULT",
    "THEOREM_REGISTRY_PROMOTION_REQUIRES_EXPLICIT_AUDITED_REVIEW",
    "PUBLICATION_ANNOUNCEMENT != CLAY_ACCEPTANCE"
  ]
}
